{
  "schema_version": "0.1.0",
  "request_id": "gr_20260410_nbb001",
  "created_at": "2026-04-10T20:15:00Z",
  "source_type": "concept_brief",
  "source_ref": {
    "path": "generated/requests/number-bond-bridge-mini/concept_brief.real.json",
    "hash": "sha256:f987b9e142296b11b4403d45204eabd192dd5311cf1d3519ce7a499b6b834d5f",
    "id": "cb_20260410_nbb001"
  },
  "artifact_type": "concept_packet_draft",
  "target_path": "generated/drafts/number-bond-bridge-mini/",
  "generator_version": "concept-packet-stub-v0.2.0",
  "mode": "draft",
  "status": "pending"
}
