{
  "schema_version": "0.1.0",
  "request_id": "gr_20260410_sls001",
  "created_at": "2026-04-10T19:10:00Z",
  "source_type": "concept_brief",
  "source_ref": {
    "path": "generated/requests/snack-line-shuffle-mini/concept_brief.real.json",
    "hash": "sha256:5f41d5a812a81d5bbfb09fd1e727f250a331ad46d86e8f87453ebbfdbbd6634b",
    "id": "cb_20260410_sls001"
  },
  "artifact_type": "concept_packet_draft",
  "target_path": "generated/drafts/snack-line-shuffle-mini/",
  "generator_version": "concept-packet-stub-v0.2.0",
  "mode": "draft",
  "status": "pending"
}
